https://beckman.illinois.edu/
<!DOCTYPE doctype html>
<!--[if lt IE 7]> <html class="no-js lt-ie9 lt-ie8 lt-ie7" lang="en"> <![endif]-->
<!--[if IE 7]>    <html class="no-js lt-ie9 lt-ie8" lang="en"> <![endif]-->
<!--[if IE 8]>    <html class="no-js lt-ie9" lang="en"> <![endif]-->
<!--[if gt IE 8]><!-->
<html class="no-js" debug="true" lang="en">
 <!--<![endif]-->
 <head>
  <link href="https://fonts.googleapis.com/css?family=Open+Sans:600,400,300,300italic,400italic" rel="stylesheet" type="text/css"/>
  <meta charset="utf-8"/>
  <title>
   Beckman Institute for Advanced Science and Technology, Beckman Institute, University of Illinois
  </title>
  <meta content="The Beckman Institute for Advanced Science and
    Technology at the University of Illinois is an interdisciplinary research institute
    devoted to leading-edge research in the physical sciences, computation, engineering,
    biology, behavior, cognition, and neuroscience." name="description"/>
  <meta content="Beckman Institute for Advanced Science and Technology" name="author"/>
  <meta content="width=device-width,initial-scale=1" name="viewport"/>
  <meta content="uGR5SZpsSFgL-s9oRDYzNOi95AaUbzwR7xAHXdOpUEQ" name="google-site-verification">
   <link href="/apple-icon-57x57.png" rel="apple-touch-icon" sizes="57x57"/>
   <link href="/apple-icon-60x60.png" rel="apple-touch-icon" sizes="60x60"/>
   <link href="/apple-icon-72x72.png" rel="apple-touch-icon" sizes="72x72"/>
   <link href="/apple-icon-76x76.png" rel="apple-touch-icon" sizes="76x76"/>
   <link href="/apple-icon-114x114.png" rel="apple-touch-icon" sizes="114x114"/>
   <link href="/apple-icon-120x120.png" rel="apple-touch-icon" sizes="120x120"/>
   <link href="/apple-icon-144x144.png" rel="apple-touch-icon" sizes="144x144"/>
   <link href="/apple-icon-152x152.png" rel="apple-touch-icon" sizes="152x152"/>
   <link href="/apple-icon-180x180.png" rel="apple-touch-icon" sizes="180x180"/>
   <link href="/android-icon-192x192.png" rel="icon" sizes="192x192" type="image/png"/>
   <link href="/favicon-32x32.png" rel="icon" sizes="32x32" type="image/png"/>
   <link href="/favicon-96x96.png" rel="icon" sizes="96x96" type="image/png"/>
   <link href="/favicon-16x16.png" rel="icon" sizes="16x16" type="image/png"/>
   <link href="/manifest.json" rel="manifest"/>
   <meta content="#ffffff" name="msapplication-TileColor"/>
   <meta content="/ms-icon-144x144.png" name="msapplication-TileImage"/>
   <meta content="#ffffff" name="theme-color"/>
   <!--[if lte IE 9]>
      <link href="/bundles/ie-css?v=NXvJtniZpC2fk3DZLCh9lChdimKvjSZvfYSzcDRU7oc1" rel="stylesheet"/>

    <![endif]-->
   <link href="/bundles/local-css?v=LMIp1FwQPbHcg6yGQprn_5qWIlNrCtm3v29Tidjqtt41" rel="stylesheet">
    <script src="/bundles/modernizr">
    </script>
    <script>
     /* Asynchronous Google Analytics snippet. */
                (function(i, s, o, g, r, a, m) {
                    i['GoogleAnalyticsObject'] = r;
                    i[r] = i[r] ||
                        function() {
                            (i[r].q = i[r].q || []).push(arguments)
                        }, i[r].l = 1 * new Date();
                    a = s.createElement(o),
                        m = s.getElementsByTagName(o)[0];
                    a.async = 1;
                    a.src = g;
                    m.parentNode.insertBefore(a, m)
                })(window, document, 'script', '//www.google-analytics.com/analytics.js', 'ga');

                ga('create', 'UA-17317115-2', 'auto', 'legacy'); 
                ga('create', 'UA-97425284-1', 'auto', 'uiuc'); 

                ga('legacy.send', 'pageView');
                ga('uiuc.send', 'pageview');
    </script>
   </link>
  </meta>
 </head>
 <body>
  <div id="page">
   <header class="container">
    <div class="inner clearfix">
     <div class="clearfix" id="brand">
      <a class="i-mark" href="https://illinois.edu">
       University of Illinois Homepage
      </a>
      <a class="wordmark" href="/">
       <span class="beckman">
       </span>
      </a>
     </div>
     <nav id="nav-global">
      <ul class="sections clearfix">
       <li class="skip">
        <a href="#main">
         Skip over main navigation
        </a>
       </li>
       <li class="about" data-section="about">
        <a href="/about">
         About
        </a>
       </li>
       <li class="research" data-section="research">
        <a href="/research">
         Research
        </a>
       </li>
       <li class="news" data-section="news">
        <a href="/news">
         News
        </a>
       </li>
       <li class="video" data-section="video">
        <a href="/video">
         Video
        </a>
       </li>
       <li class="events" data-section="events">
        <a href="/events">
         Events
        </a>
       </li>
       <li class="directory" data-section="directory">
        <a href="/directory">
         People
        </a>
       </li>
       <li class="search" data-section="search">
        <a href="/search">
         Search
        </a>
       </li>
      </ul>
     </nav>
    </div>
   </header>
   <div class="container" id="nav-global-menus">
    <div class="navglobal-menu" data-menu="about">
     <nav class="row clearfix">
      <ul class="section">
       <h2>
        <a href="/about/beckman">
         Beckman Institute
        </a>
       </h2>
       <li>
        <a href="/about/beckman/history">
         History
        </a>
       </li>
       <li>
        <a href="/about/beckman/innovation-and-discovery">
         Innovation and Discovery
        </a>
       </li>
       <li>
        <a href="/about/beckman/arnold-and-mabel">
         Arnold and Mabel Beckman
        </a>
       </li>
       <li>
        <a href="/about/beckman/building">
         Building Info
        </a>
       </li>
       <li>
        <a href="/about/beckman/employment">
         Employment
        </a>
       </li>
       <li>
        <a href="/about/beckman/policies">
         Policies
        </a>
       </li>
       <li>
        <a href="/about/beckman/Mission-and-Core-Values">
         Mission and Core Values
        </a>
       </li>
       <li>
        <a href="/about/beckman/organization">
         Organization
        </a>
       </li>
      </ul>
      <ul class="section">
       <h2>
        <a href="/about/contact">
         Contact
        </a>
       </h2>
       <li>
        <a href="/directory">
         Directory
        </a>
       </li>
       <li>
        <a href="/about/contact/travel">
         Travel Information
        </a>
       </li>
       <li>
        <a href="/events/plan/space-reservations">
         Space Reservations
        </a>
       </li>
      </ul>
      <ul class="section">
       <h2>
        <a href="/about/giving">
         Give to the Beckman Institute
        </a>
       </h2>
       <li>
        <a href="/about/giving/beckman-scholarship-fund">
         Beckman Scholarship Fund
        </a>
       </li>
       <li>
        <a href="/about/giving/beckman-support-fund">
         Beckman Support Fund
        </a>
       </li>
       <li>
        <a href="/about/giving/smith-memorial-fund">
         Nadine Barrie Smith Memorial Fund
        </a>
       </li>
       <li>
        <a href="/about/giving/haferkamp-memorial-fund">
         Erik Haferkamp Memorial Fund
        </a>
       </li>
       <li>
        <a href="/about/giving/huang-graduate-research-fund">
         Thomas and Margaret Huang Fund for Graduate Research
        </a>
       </li>
       <li>
        <a href="/about/giving/janssen-undergrad-research-fund">
         Janssen Family Undergraduate Research Fund
        </a>
       </li>
       <li>
        <a href="/about/giving/schulten-memorial-fund">
         Klaus Schulten Memorial Fund
        </a>
       </li>
      </ul>
      <ul class="section last">
       <h2>
        <a href="/about/services">
         Services
        </a>
       </h2>
       <li>
        <a href="/about/services/beckman-cafe">
         Beckman Café
        </a>
       </li>
       <li>
        <a href="/about/services/catering">
         Beckman Catering
        </a>
       </li>
       <li>
        <a href="/about/services/communications-office">
         Communications Office
        </a>
       </li>
       <li>
        <a href="/its">
         Information Technology Services
        </a>
       </li>
       <li>
        <a href="https://intranet.beckman.illinois.edu">
         Intranet
        </a>
       </li>
       <li>
        <a href="/about/services/security">
         Security
        </a>
       </li>
       <li>
        <a href="/about/services/shipping-receiving">
         Shipping &amp; Receiving
        </a>
       </li>
      </ul>
     </nav>
    </div>
    <!-- End .navglobal-menu -->
    <div class="navglobal-menu" data-menu="research">
     <nav class="row clearfix">
      <ul class="section">
       <h2>
        <a href="/research/themes">
         Research Themes
        </a>
       </h2>
       <li>
        <a href="/research/themes/intim">
         Integrative Imaging
        </a>
       </li>
       <li>
        <a href="/research/themes/intelligent-systems">
         Intelligent Systems
        </a>
       </li>
       <li>
        <a href="/research/themes/mse">
         Molecular Science and Engineering
        </a>
       </li>
      </ul>
      <ul class="section">
       <h2>
        <a href="/research/facilities">
         Facilities
        </a>
       </h2>
       <li>
        <a href="/research/facilities/bic">
         Biomedical Imaging Center
        </a>
       </li>
       <li>
        <a href="/research/facilities/itg">
         Imaging Technology Group
        </a>
       </li>
      </ul>
      <ul class="section">
       <h2>
        <span class="nav-menu-heading">
         Initiatives
        </span>
       </h2>
       <li>
        <a href="http://21centurysci.beckman.illinois.edu">
         21st Century Scientists
        </a>
       </li>
       <li>
        <a href="http://brainplasticity.illinois.edu">
         Center for Brain Plasticity
        </a>
       </li>
       <li>
        <a href="https://cancer.illinois.edu/">
         Cancer Center
        </a>
       </li>
      </ul>
      <ul class="section last">
       <h2>
        <a href="/research/fellows-and-awards">
         Fellowships &amp; Awards
        </a>
       </h2>
       <li>
        <a href="/research/fellows-and-awards/graduate">
         Graduate Fellows Program
        </a>
       </li>
       <li>
        <a href="/research/fellows-and-awards/postdoctoral">
         Postdoctoral Fellows Program
        </a>
       </li>
       <li>
        <a href="/research/fellows-and-awards/undergraduate">
         Undergraduate Fellows
        </a>
       </li>
       <li>
        <a href="/research/fellows-and-awards/senior">
         Senior Fellows
        </a>
       </li>
       <li>
        <a href="/research/fellows-and-awards/carle-beckman">
         Carle Foundation Hospital - Beckman Institute Fellowship
        </a>
       </li>
       <li>
        <a href="/research/fellows-and-awards/nadine-barrie-smith">
         Nadine Barrie Smith Memorial Fellows Program
        </a>
       </li>
       <li>
        <a href="/research/fellows-and-awards/carle-neuroscience-institute">
         Carle Neuroscience Institute Undergraduate Research Award
        </a>
       </li>
       <li>
        <a href="/research/fellows-and-awards/clear">
         CLEAR Awards
        </a>
       </li>
       <li>
        <a href="/research/fellows-and-awards/haferkamp">
         Erik Haferkamp Memorial Award
        </a>
       </li>
       <li>
        <a href="/research/fellows-and-awards/huang">
         Thomas and Margaret Huang Award
        </a>
       </li>
       <li>
        <a href="/research/fellows-and-awards/janssen">
         Janssen Family Undergraduate Research Award
        </a>
       </li>
       <li>
        <a href="/research/fellows-and-awards/neurotech-memory-cognition">
         Neurotechnology for Memory and Cognition Awards
        </a>
       </li>
      </ul>
     </nav>
    </div>
    <!-- End .navglobal-menu -->
    <div class="navglobal-menu" data-menu="news">
     <nav class="row clearfix">
      <ul class="section double-wide">
       <h2>
        <a href="/news">
         Headlines
        </a>
       </h2>
       <li>
        <a href="/news/2019/02/ds-martha_gillette_march19">
         Martha Gillette to Discuss Brain Metabolism, Sleep in March 7 Director's Seminar
        </a>
       </li>
       <li>
        <a href="/news/2019/03/dobruckicochair">
         Dobrucki Named Co-chair of Integrative Imaging Research Theme
        </a>
       </li>
       <li>
        <a href="/news/2019/03/beckman_fellows2019">
         2019 Beckman Postdoctoral Fellows Announced
        </a>
       </li>
       <li>
        <a href="/news/2019/02/gss-mar06">
         March 6 Grad Seminar Features Cancer Imaging, Neuropeptides, and Ultrafast Photography and Microscopy
        </a>
       </li>
       <li>
        <a href="/news/2019/02/barbey_journalparticipation19">
         Barbey Seeking Multidisciplinary Participation in Special Issue of ‘Journal of Intelligence’ on Human and Machine Intelligence
        </a>
       </li>
      </ul>
      <ul class="section">
       <h2>
        <a href="/news">
         Archive
        </a>
       </h2>
       <li>
        <a href="/news/2019">
         News from 2019
        </a>
       </li>
       <li>
        <a href="/news/2018">
         News from 2018
        </a>
       </li>
       <li>
        <a href="/news/2017">
         News from 2017
        </a>
       </li>
       <li>
        <a href="/news/2016">
         News from 2016
        </a>
       </li>
       <li>
        <a href="/news/2015">
         View more news
        </a>
       </li>
      </ul>
      <ul class="section last">
       <h2>
        <a href="/news/publications">
         Publications
        </a>
       </h2>
       <li>
        <a href="/news/publications/annual-report">
         Annual Report
        </a>
       </li>
       <li>
        <a href="/news/publications/bulletin">
         Beckman Bulletin
        </a>
       </li>
       <li>
        <a href="/news/publications/synergy">
         Synergy
        </a>
       </li>
      </ul>
     </nav>
    </div>
    <!-- End .navglobal-menu -->
    <div class="navglobal-menu" data-menu="video">
     <div class="videos row clearfix">
      <div class="video tracked" data-action="Navbar view" data-category="Videos" data-label="Future Environments: Future Farming">
       <div class="screenshot">
        <a href="/video/watch/5dE9h1oigPM">
         <img alt="Thumbnail of Future Environments: Future Farming video" src="https://img.youtube.com/vi/5dE9h1oigPM/mqdefault.jpg"/>
         <div class="play-button">
          Play
         </div>
        </a>
       </div>
       <a class="title" href="/video/watch/5dE9h1oigPM">
        Future Environments: Future Farming
       </a>
      </div>
      <div class="video tracked" data-action="Navbar view" data-category="Videos" data-label="Future Environments: Bio-Inspired Materials">
       <div class="screenshot">
        <a href="/video/watch/ROD0IHAc22s">
         <img alt="Thumbnail of Future Environments: Bio-Inspired Materials video" src="https://img.youtube.com/vi/ROD0IHAc22s/mqdefault.jpg"/>
         <div class="play-button">
          Play
         </div>
        </a>
       </div>
       <a class="title" href="/video/watch/ROD0IHAc22s">
        Future Environments: Bio-Inspired Materials
       </a>
      </div>
      <div class="video tracked" data-action="Navbar view" data-category="Videos" data-label="Future Environments: Household Chemicals">
       <div class="screenshot">
        <a href="/video/watch/gBNiwPxHpXE">
         <img alt="Thumbnail of Future Environments: Household Chemicals video" src="https://img.youtube.com/vi/gBNiwPxHpXE/mqdefault.jpg"/>
         <div class="play-button">
          Play
         </div>
        </a>
       </div>
       <a class="title" href="/video/watch/gBNiwPxHpXE">
        Future Environments: Household Chemicals
       </a>
      </div>
      <div class="video last tracked" data-action="Navbar view" data-category="Videos" data-label="Future Environments: Cancer Microenvironments">
       <div class="screenshot">
        <a href="/video/watch/IG_z4wzi_Pw">
         <img alt="Thumbnail of Future Environments: Cancer Microenvironments video" src="https://img.youtube.com/vi/IG_z4wzi_Pw/mqdefault.jpg"/>
         <div class="play-button">
          Play
         </div>
        </a>
       </div>
       <a class="title" href="/video/watch/IG_z4wzi_Pw">
        Future Environments: Cancer Microenvironments
       </a>
      </div>
     </div>
    </div>
    <!-- End .navglobal-menu -->
    <div class="navglobal-menu" data-menu="events">
     <nav class="row clearfix">
      <ul class="section double-wide">
       <h2>
        <a href="/events">
         Events
        </a>
       </h2>
       <li>
        <a href="https://calendars.illinois.edu/detail/4595?eventId=33324179">
         03/11: Theoretical and Computational Biophysics Seminar
        </a>
       </li>
       <li>
        <a href="https://calendars.illinois.edu/detail/4595?eventId=33335234">
         03/12: Curious Eclectic Seminar Series
        </a>
       </li>
       <li>
        <a href="https://calendars.illinois.edu/detail/4595?eventId=33335323">
         03/12: 2019 NSP Spring Seminar Series
        </a>
       </li>
       <li>
        <a href="https://calendars.illinois.edu/detail/4595?eventId=33331265">
         03/13: Yoga at Beckman
        </a>
       </li>
      </ul>
      <ul class="section">
       <h2>
        <a href="/events/plan">
         Event Planning
        </a>
       </h2>
       <li>
        <a href="/events/plan/space-reservations">
         Space Reservations
        </a>
       </li>
       <li>
        <a href="/about/services/catering">
         Catering Information
        </a>
       </li>
       <li>
        <a href="/about/contact/travel">
         Directions to Beckman
        </a>
       </li>
       <li>
        <a href="/events/plan/room-capacities-and-rates">
         Meeting Rooms
        </a>
       </li>
      </ul>
      <ul class="section last">
       <h2>
        <a href="https://calendars.illinois.edu/list/4595">
         Events At Beckman
        </a>
       </h2>
       <li>
        <a href="https://calendars.illinois.edu/list/4595">
         All Events Calendar
        </a>
       </li>
       <li>
        <a href="/events/calendars/directors-seminar">
         Director's Seminar
        </a>
       </li>
       <li>
        <a href="/events/calendars/thursday-concerts">
         Thursdays@12:20 Concerts
        </a>
       </li>
       <li>
        <a href="/events/open-house">
         Beckman Open House
        </a>
       </li>
       <li>
        <a href="/events/smithgroup-lectures">
         SmithGroup Lecture Series
        </a>
       </li>
       <li>
        <a href="/events/beckman-brown">
         Beckman-Brown Annual Lecture
        </a>
       </li>
       <li>
        <a href="/events/tech-talks">
         Tech Talks on Tuesdays
        </a>
       </li>
       <li>
        <a href="/events/confronting-climate-change">
         Confronting the Challenges of Climate Change
        </a>
       </li>
      </ul>
     </nav>
    </div>
    <!-- End .navglobal-menu -->
    <div class="navglobal-menu" data-menu="search">
     <div class="search container clearfix">
      <div class="search row clearfix">
       <form action="/Search" id="sitesearch" method="get" name="sitesearch">
        <label for="q">
         Search the Beckman Institute Website
        </label>
        <input autocomplete="off" id="q" name="q" type="text" value="Search here"/>
        <button type="submit">
         <span>
          Go
         </span>
        </button>
       </form>
      </div>
     </div>
    </div>
    <!-- End .navglobal-menu -->
    <!-- End if("show-menu" == ...) -->
   </div>
   <!-- End #nav-global-menus -->
   <section class="container" id="feature">
    <div class="visuallyhidden">
     <h1>
      Welcome to the Beckman Institute
     </h1>
    </div>
    <div id="slideshow">
     <div class="clearfix" id="showintro-wrap">
      <div class="row clearfix" id="showintro">
       <div class="background-layer">
        <!--needed for background-->
       </div>
       <h2 style="line-height: 1.1em">
        Don’t miss Beckman’s 2019
        <br/>
        Open House March 8 &amp; 9
       </h2>
       <p>
        More than 40 exhibits offer fun for all ages and a behind the scenes look at the institute.
       </p>
       <p>
        <a class="button" href="https://beckman.illinois.edu/events/open-house">
         Read more
        </a>
       </p>
      </div>
     </div>
     <div class="slides clearfix" id="showslides">
      <div class="slide showing intro-slide" data-slide="1">
       <img alt="Children look through a microscope at Beckman Open House" class="slide-image" src="../../Content/images/feature/OpenHouseBanner2_2019.jpg" style="width: 1440px; height: 600px;"/>
      </div>
     </div>
    </div>
   </section>
   <section class="container clearfix" id="communications">
    <div class="row clearfix">
     <!-- Latest News Articles -->
     <div class="eightcol" id="news">
      <h1>
       Beckman News
      </h1>
      <!-- start article -->
      <article class="preview beckman expanded feature">
       <h2>
        <b>
         Feb
         <i>
          27
         </i>
        </b>
        <a href="/news/2019/02/ds-martha_gillette_march19">
         Martha Gillette to Discuss Brain Metabolism, Sleep in March 7 Director's Seminar
        </a>
       </h2>
       <section>
        <h3>
         <a href="/news/2019/02/ds-martha_gillette_march19">
          Martha Gillette to Discuss Brain Metabolism, Sleep in March 7 Director's Seminar
         </a>
        </h3>
        <p>
         Martha Gillette, director of the U of I Neuroscience Program, will speak at the next Beckman Institute Director's Seminar at noon Thursday, March 7, in Room 1005. Gillette will discuss “The Clocks that Time Us: Dynamics in Brain Metabolism and Sleep." Lunch is provided.
        </p>
        <div class="article-links">
         <span class="social-links">
          <a class="social-link twitter" href="https://twitter.com/share?original_referer=https://beckman.illinois.edu&amp;url=https://beckman.illinois.edu/news/2019/02/ds-martha_gillette_march19&amp;text=Via @BeckmanInst: Martha Gillette to Discuss Brain Metabolism, Sleep in March 7 Director's Seminar">
           <span>
            Tweet
           </span>
          </a>
          <a class="social-link facebook" href="https://www.facebook.com/sharer.php?u=https://beckman.illinois.edu/news/2019/02/ds-martha_gillette_march19">
           <span>
            Share
           </span>
          </a>
          <a class="social-link google" href="https://plusone.google.com/_/+1/confirm?hl=en&amp;url=https://beckman.illinois.edu/news/2019/02/ds-martha_gillette_march19">
           <span>
            +1
           </span>
          </a>
         </span>
         <a class="article-link" href="/news/2019/02/ds-martha_gillette_march19">
          Read article →
         </a>
        </div>
       </section>
      </article>
      <!-- end -->
      <!-- start article -->
      <article class="preview beckman ">
       <h2>
        <b>
         Mar
         <i>
          01
         </i>
        </b>
        <a href="/news/2019/03/dobruckicochair">
         Dobrucki Named Co-chair of Integrative Imaging Research Theme
        </a>
       </h2>
       <section>
        <p>
         Wawrzyniec Dobrucki, an assistant professor of bioengineering and a faculty member at the Carle Illinois College of Medicine, has been named a co-chair of the Beckman Institute’s Integrative Imaging research theme.
        </p>
        <div class="article-links">
         <a class="article-link" href="/news/2019/03/dobruckicochair">
          Read article →
         </a>
         <span class="social-links">
          <a class="social-link twitter" href="https://twitter.com/share?url=https://beckman.illinois.edu/news/2019/03/dobruckicochair&amp;text=Via @BeckmanInst: Dobrucki Named Co-chair of Integrative Imaging Research Theme">
           <span>
            Tweet
           </span>
          </a>
          <a class="social-link facebook" href="https://www.facebook.com/sharer.php?u=https://beckman.illinois.edu/news/2019/03/dobruckicochair">
           <span>
            Share
           </span>
          </a>
          <a class="social-link google" href="https://plusone.google.com/_/+1/confirm?hl=en&amp;url=https://beckman.illinois.edu/news/2019/03/dobruckicochair">
           <span>
            +1
           </span>
          </a>
         </span>
        </div>
       </section>
      </article>
      <!-- end -->
      <!-- start article -->
      <article class="preview beckman ">
       <h2>
        <b>
         Mar
         <i>
          01
         </i>
        </b>
        <a href="/news/2019/03/beckman_fellows2019">
         2019 Beckman Postdoctoral Fellows Announced
        </a>
       </h2>
       <section>
        <p>
         The Beckman Institute has named five new Postdoctoral Fellows. Their work covers a variety of topics, from diagnosing and treating breast cancer and osteosarcoma, to better fighting fungal infections, to developing energy-efficient manufacturing methods, to exploring the supramolecular assembly of materials.
        </p>
        <div class="article-links">
         <a class="article-link" href="/news/2019/03/beckman_fellows2019">
          Read article →
         </a>
         <span class="social-links">
          <a class="social-link twitter" href="https://twitter.com/share?url=https://beckman.illinois.edu/news/2019/03/beckman_fellows2019&amp;text=Via @BeckmanInst: 2019 Beckman Postdoctoral Fellows Announced">
           <span>
            Tweet
           </span>
          </a>
          <a class="social-link facebook" href="https://www.facebook.com/sharer.php?u=https://beckman.illinois.edu/news/2019/03/beckman_fellows2019">
           <span>
            Share
           </span>
          </a>
          <a class="social-link google" href="https://plusone.google.com/_/+1/confirm?hl=en&amp;url=https://beckman.illinois.edu/news/2019/03/beckman_fellows2019">
           <span>
            +1
           </span>
          </a>
         </span>
        </div>
       </section>
      </article>
      <!-- end -->
      <!-- start article -->
      <article class="preview beckman ">
       <h2>
        <b>
         Feb
         <i>
          26
         </i>
        </b>
        <a href="/news/2019/02/gss-mar06">
         March 6 Grad Seminar Features Cancer Imaging, Neuropeptides, and Ultrafast Photography and Microscopy
        </a>
       </h2>
       <section>
        <p>
         Hailey Knox and Yayao Ma, Beckman Institute Graduate Fellows, and Krishna D.B. Anapindi, a Ph.D. student in applied statistics, will present their research at the Beckman Institute Graduate Student Seminar at noon Wednesday, March 6, in Room 1005 Beckman Institute. Lunch will be served.
        </p>
        <div class="article-links">
         <a class="article-link" href="/news/2019/02/gss-mar06">
          Read article →
         </a>
         <span class="social-links">
          <a class="social-link twitter" href="https://twitter.com/share?url=https://beckman.illinois.edu/news/2019/02/gss-mar06&amp;text=Via @BeckmanInst: March 6 Grad Seminar Features Cancer Imaging, Neuropeptides, and Ultrafast Photography and Microscopy">
           <span>
            Tweet
           </span>
          </a>
          <a class="social-link facebook" href="https://www.facebook.com/sharer.php?u=https://beckman.illinois.edu/news/2019/02/gss-mar06">
           <span>
            Share
           </span>
          </a>
          <a class="social-link google" href="https://plusone.google.com/_/+1/confirm?hl=en&amp;url=https://beckman.illinois.edu/news/2019/02/gss-mar06">
           <span>
            +1
           </span>
          </a>
         </span>
        </div>
       </section>
      </article>
      <!-- end -->
      <!-- start article -->
      <article class="preview beckman ">
       <h2>
        <b>
         Feb
         <i>
          25
         </i>
        </b>
        <a href="/news/2019/02/barbey_journalparticipation19">
         Barbey Seeking Multidisciplinary Participation in Special Issue of ‘Journal of Intelligence’ on Human and Machine Intelligence
        </a>
       </h2>
       <section>
        <p>
         Aron Barbey, the Emanuel Donchin Professorial Scholar of Psychology and associate professor of psychology, neuroscience, and bioengineering, invites all scientists to participate in a special issue of "Journal of Intelligence." The deadline for submissions is in August.
        </p>
        <div class="article-links">
         <a class="article-link" href="/news/2019/02/barbey_journalparticipation19">
          Read article →
         </a>
         <span class="social-links">
          <a class="social-link twitter" href="https://twitter.com/share?url=https://beckman.illinois.edu/news/2019/02/barbey_journalparticipation19&amp;text=Via @BeckmanInst: Barbey Seeking Multidisciplinary Participation in Special Issue of ‘Journal of Intelligence’ on Human and Machine Intelligence">
           <span>
            Tweet
           </span>
          </a>
          <a class="social-link facebook" href="https://www.facebook.com/sharer.php?u=https://beckman.illinois.edu/news/2019/02/barbey_journalparticipation19">
           <span>
            Share
           </span>
          </a>
          <a class="social-link google" href="https://plusone.google.com/_/+1/confirm?hl=en&amp;url=https://beckman.illinois.edu/news/2019/02/barbey_journalparticipation19">
           <span>
            +1
           </span>
          </a>
         </span>
        </div>
       </section>
      </article>
      <!-- end -->
     </div>
     <!-- End Latest News Articles -->
     <!-- Other News -->
     <div class="fourcol last" id="media">
      <h1>
       Videos
      </h1>
      <div class="clearfix" id="recent-videos">
       <div class="clearfix" id="video-list">
        <a class="tracked video showing" data-action="Homepage view" data-category="Videos" data-id="5dE9h1oigPM" data-label="Future Environments: Future Farming" href="/video/watch/5dE9h1oigPM">
         <h2>
          Future Environments: Future Farming
         </h2>
         <img alt="Screenshot taken of this video" src="https://img.youtube.com/vi/5dE9h1oigPM/mqdefault.jpg"/>
         <p>
          Naira Hovakimyan discusses how drones, planes, satellites, and artificial intelligence will help farmers meet the food needs of our growing world population.    

Havakimyan is the W. Grafton and Lillian B. Wilkins Professor of Mechanical Science and Engineering at the University of Illinois at Urbana-Champaign. She is also a member of the CLEAR initiative at the Beckman Institute for Advanced Science and Technology and Chief Scientist for IntelinAir.
         </p>
        </a>
        <a class="tracked video " data-action="Homepage view" data-category="Videos" data-id="ROD0IHAc22s" data-label="Future Environments: Bio-Inspired Materials" href="/video/watch/ROD0IHAc22s">
         <h2>
          Future Environments: Bio-Inspired Materials
         </h2>
         <img alt="Screenshot taken of this video" src="https://img.youtube.com/vi/ROD0IHAc22s/mqdefault.jpg"/>
         <p>
          Jeffrey Moore discusses bio-inspired, vascularized materials and how manufacturers will take inspiration from the natural world to create better products.  Moore discusses how many manufactured goods of the future will include vascular networks that make them more adaptable, functional, and longer-lasting.   Moore is a professor of Chemistry and Materials Science and the Director of the Beckman Institute for Advanced Science and Technology at the University of Illinois at Urbana-Champaign.
         </p>
        </a>
        <a class="tracked video " data-action="Homepage view" data-category="Videos" data-id="gBNiwPxHpXE" data-label="Future Environments: Household Chemicals" href="/video/watch/gBNiwPxHpXE">
         <h2>
          Future Environments: Household Chemicals
         </h2>
         <img alt="Screenshot taken of this video" src="https://img.youtube.com/vi/gBNiwPxHpXE/mqdefault.jpg"/>
         <p>
          Comparative biosciences professor Susan Schantz warns how common chemicals around the house can impact human development and what can be done to help protect children.

Schantz is a professor of Comparative Biosciences at the University of Illinois at Urbana-Champaign.  She is also a member of the Cellular and Molecular Foundations of Intelligent Behavior group at the Beckman Institute.

What have you done to reduce your exposure to potentially harmful chemicals?
Tell us at #scifuture.

And to read a full Q&amp;A with Professor Schantz about chemical contaminants in our home environments, please visit...
http://beckman.illinois.edu/news/
         </p>
        </a>
        <a class="tracked video " data-action="Homepage view" data-category="Videos" data-id="IG_z4wzi_Pw" data-label="Future Environments: Cancer Microenvironments" href="/video/watch/IG_z4wzi_Pw">
         <h2>
          Future Environments: Cancer Microenvironments
         </h2>
         <img alt="Screenshot taken of this video" src="https://img.youtube.com/vi/IG_z4wzi_Pw/mqdefault.jpg"/>
         <p>
          Bioengineering professor Rohit Bhargava discusses how advances in chemical imaging, machine learning, and 3D printing are changing how we think of and fight cancer.  Cancer is more than just an isolated collection of diseased cells.  The environment around the tumor plays an important part in whether the cancer spreads or not.  By building real-world 3D models of a tumor environments, scientists hope to better predict and fight cancer growth.
         </p>
        </a>
        <a class="tracked video " data-action="Homepage view" data-category="Videos" data-id="xaKyeFQu8NQ" data-label="Future Environments: Energy Everywhere" href="/video/watch/xaKyeFQu8NQ">
         <h2>
          Future Environments: Energy Everywhere
         </h2>
         <img alt="Screenshot taken of this video" src="https://img.youtube.com/vi/xaKyeFQu8NQ/mqdefault.jpg"/>
         <p>
          From cell phones to electric cars, society is more and more dependent on reliable and portable energy.  University of Illinois Professor Nancy Sottos discusses green energy and our ever-growing need for energy storage.

Sottos is a professor in the Materials Science and Engineering department at the University of Illinois at Urbana-Champaign and a member of the Beckman Institute's Autonomous Materials Systems group.

To read a full Q&amp;A with Professor Sottos about the future of energy storage, please visit...
https://beckman.illinois.edu/news/2018/6/scifuture-energy

Energy storage is a huge challenge for a greener future.  What  hurdles do you think green energy faces?  
Join the conversation: #scifuture
         </p>
        </a>
        <a class="tracked video " data-action="Homepage view" data-category="Videos" data-id="UoU9tQw8wJ4" data-label="Future Environments: Doctor's Office of the Future" href="/video/watch/UoU9tQw8wJ4">
         <h2>
          Future Environments: Doctor's Office of the Future
         </h2>
         <img alt="Screenshot taken of this video" src="https://img.youtube.com/vi/UoU9tQw8wJ4/mqdefault.jpg"/>
         <p>
          The handheld medical devices of science fiction are becoming science fact.  Doctor Stephen Boppart looks at how technology, including phones and personal health monitors, will change our visits to the doctor's office and our relationship to our own health.

Boppart is an MD, Ph.D. and professor in the Electrical and Computer Engineering and Bioengineering departments at the University of Illinois at Urbana-Champaign.

What do you think the future of health care will look like?  
Tell us at #scifuture.

And to read a full Q&amp;A with Dr. Boppart about the doctor's office of the future, please visit...
https://beckman.illinois.edu/news/2018/5/scifuture-doctor
         </p>
        </a>
        <a class="tracked video " data-action="Homepage view" data-category="Videos" data-id="sa9p4SlZzV8" data-label="Using Light to Diagnose Disease" href="/video/watch/sa9p4SlZzV8">
         <h2>
          Using Light to Diagnose Disease
         </h2>
         <img alt="Screenshot taken of this video" src="https://img.youtube.com/vi/sa9p4SlZzV8/mqdefault.jpg"/>
         <p>
          Professor Stephen Boppart uses light to diagnose diseases such as cancer.  Called "biophotonics," the technique generates high-resolution, real-time, non-invasive images of biological tissue at the cellular and molecular level.  Boppart is a professor at the University of Illinois at Urbana-Champaign in the departments of Electrical and Computer Engineering and Bioengineering.  He heads the Biophotonics Imaging Laboratory at the Beckman Institute and is a full-time faculty member in the Bioimaging Science and Technology group.
         </p>
        </a>
        <a class="tracked video " data-action="Homepage view" data-category="Videos" data-id="ZSrbDjWozpM" data-label='"Pi Day" Number Song' href="/video/watch/ZSrbDjWozpM">
         <h2>
          "Pi Day" Number Song
         </h2>
         <img alt="Screenshot taken of this video" src="https://img.youtube.com/vi/ZSrbDjWozpM/mqdefault.jpg"/>
         <p>
          March 14 (3.14) is "Pi Day."  Sing along with our favorite mathematical constant.
         </p>
        </a>
        <a class="tracked video " data-action="Homepage view" data-category="Videos" data-id="9RM-agDT-0s" data-label="Using Light Pulses to Control Neurons" href="/video/watch/9RM-agDT-0s">
         <h2>
          Using Light Pulses to Control Neurons
         </h2>
         <img alt="Screenshot taken of this video" src="https://img.youtube.com/vi/9RM-agDT-0s/mqdefault.jpg"/>
         <p>
          Professor Stephen Boppart uses ultrafast pulses of tailored light to make neurons fire in different patterns. This is the first example of "coherent control" in a living cell.  The technique may lead to one day using light as a therapy to improve people's health.  Boppart is a professor in the Department of Electrical and Computer Engineering and the Department of Bioengineering at the University of Illinois at Urbana-Champaign.  He is also a member of the Bioimaging Science and Technology Group at the Beckman Institute.

For more information on this research, please visit:
https://news.illinois.edu/blog/view/6367/579772
         </p>
        </a>
        <a class="tracked video " data-action="Homepage view" data-category="Videos" data-id="vcLNbsVDrNQ" data-label="60 Second Science: Rohit Bhargava on Chemical Imaging" href="/video/watch/vcLNbsVDrNQ">
         <h2>
          60 Second Science: Rohit Bhargava on Chemical Imaging
         </h2>
         <img alt="Screenshot taken of this video" src="https://img.youtube.com/vi/vcLNbsVDrNQ/mqdefault.jpg"/>
         <p>
          Beckman Institute Bioimaging Science and Technology group member Rohit Bhargava presents his research in sixty seconds.  

Bhargava is a pioneer in the development of infrared spectroscopic imaging and works to develop novel chemical imaging technologies and instrumentation that can be employed to detect, diagnose and understand tissue structures and cancer pathology.

He is Bliss Faculty Scholar and Professor of Bioengineering and has appointments in Chemical &amp; Biomolecular Engineering, Mechanical Science &amp; Engineering, Electrical &amp; Computer Engineering and Chemistry at the University of Illinois at Urbana-Champaign.  Bhargava also founded and serves as the Director of the Cancer Community@Illinois, a University-wide effort dedicated to advancing cancer-related research and scholarship at Illinois.
         </p>
        </a>
        <a class="tracked video " data-action="Homepage view" data-category="Videos" data-id="rNQkossfP7U" data-label="60 Second Science: Stephen Boppart on Using Light to Diagnose Disease" href="/video/watch/rNQkossfP7U">
         <h2>
          60 Second Science: Stephen Boppart on Using Light to Diagnose Disease
         </h2>
         <img alt="Screenshot taken of this video" src="https://img.youtube.com/vi/rNQkossfP7U/mqdefault.jpg"/>
         <p>
          Beckman Institute Bioimaging Science and Technology group member Stephen Boppart presents his research in sixty seconds.  

As the head of the Biophotonics Imaging Laboratory at the Beckman Institute, Boppart uses light to image biological tissue and diagnose disease.  

By combining optical imaging, biophotonics, and other advanced imaging techniques with clinical research, Boppart creates high-resolution, real-time, non-invasive images of biological tissue at the cellular and molecular level for diagnosing diseases such as cancer.

Boppart is a professor at the University of Illinois at Urbana-Champaign in the departments of Electrical and Computer Engineering and Bioengineering, and is affiliated with the Department of Internal Medicine in the College of Medicine, the Micro and Nanotechnology Laboratory, and the Institute for Genomic Biology.
         </p>
        </a>
        <a class="tracked video " data-action="Homepage view" data-category="Videos" data-id="0jjehPdnSkQ" data-label="Not Finding Nemo: Clownfish in the Lab and the Wild" href="/video/watch/0jjehPdnSkQ">
         <h2>
          Not Finding Nemo: Clownfish in the Lab and the Wild
         </h2>
         <img alt="Screenshot taken of this video" src="https://img.youtube.com/vi/0jjehPdnSkQ/mqdefault.jpg"/>
         <p>
          Researchers discuss the differences in working with anemonefish, better known as clownfish, in their lab at the University of Illinois and in the wilds of Indonesia.  

Justin Rhodes is a Professor of Psychology and member of the NeuroTech Group at the Beckman Institute at the University of Illinois at Urbana-Champaign.      Ross DeAngelis is a graduate research assistant in the Cellular and Molecular Foundations of Intelligent Behavior Group at the Beckman Institute.
         </p>
        </a>
        <a class="tracked video " data-action="Homepage view" data-category="Videos" data-id="oztHwnfl-38" data-label="Nemo's Dad: Clownfish Fathering - EMMY Winner" href="/video/watch/oztHwnfl-38">
         <h2>
          Nemo's Dad: Clownfish Fathering - EMMY Winner
         </h2>
         <img alt="Screenshot taken of this video" src="https://img.youtube.com/vi/oztHwnfl-38/mqdefault.jpg"/>
         <p>
          Clownfish dads are some of the best fathers in all of nature.  Unlike most vertebrates, clownfish males are the primary caretakers of the eggs and spend most of their time nipping and fanning them to ensure their survival.  

Also known as anemonefish, this species gives researchers at the Beckman Institute a valuable window into the powerful hormonal changes that take place in the brains of nurturing fathers.   

Justin Rhodes is a Professor of Psychology and member of the NeuroTech Group at the Beckman Institute at the University of Illinois at Urbana-Champaign.      Ross DeAngelis is a graduate research assistant in the Cellular and Molecular Foundations of Intelligent Behavior Group at the Beckman Institute.

To learn more about this research, please visit...
https://news.illinois.edu/blog/view/6367/495695

This video won the 2018 Mid-America EMMY Award for best "Informational/Instructional: Feature Segment."
         </p>
        </a>
        <a class="tracked video " data-action="Homepage view" data-category="Videos" data-id="03aq4tMI_2g" data-label="60 Second Science: Justin Rhodes on Studying Mice and Clownfish" href="/video/watch/03aq4tMI_2g">
         <h2>
          60 Second Science: Justin Rhodes on Studying Mice and Clownfish
         </h2>
         <img alt="Screenshot taken of this video" src="https://img.youtube.com/vi/03aq4tMI_2g/mqdefault.jpg"/>
         <p>
          Beckman Institute NeoroTech Group member Justin Rhodes presents his research in sixty seconds.

His fields of research interests are behavioral genetics and neurobiology of motivation and addiction, and effects of exercise on brain function and cognition using mice as a model organism.  He also has an extensive research program looking at the neurobiological processes involved when clownfish change their sex from male to female.

Rhodes is an Associate Professor in the Department of Psychology at the University of Illinois at Urbana-Champaign.  He is also a member of the Neuroscience Program and the Institute for Genomic Biology.
         </p>
        </a>
        <a class="tracked video " data-action="Homepage view" data-category="Videos" data-id="XfI4fqmFZOM" data-label="Lawrence Kline Discusses Arnold Beckman and Ted Brown (Oral History)" href="/video/watch/XfI4fqmFZOM">
         <h2>
          Lawrence Kline Discusses Arnold Beckman and Ted Brown (Oral History)
         </h2>
         <img alt="Screenshot taken of this video" src="https://img.youtube.com/vi/XfI4fqmFZOM/mqdefault.jpg"/>
         <p>
          Board member Dr. Lawrence Kline discusses Arnold Beckman and his foundation, the birth of interdisciplinary research at the Beckman Institute, and Ted Brown, the Institute's founding Director.

Dr. Kline is a pulmonary, critical care, sleep doctor at Scripps Memorial Hospital.  He was the personal physician for Arnold Beckman for over a decade and has served as a board member on the Arnold and Mabel Beckman Foundation since 2013.
         </p>
        </a>
       </div>
       <div class="play-button tracked" data-action="Homepage view" data-category="Videos" data-label="Unknonw Video: Play button clicked.">
        Play
       </div>
       <nav class="clearfix">
        <a class="play" href="/video">
         <span>
          Go to Video Archive →
         </span>
        </a>
        <a class="button prev disabled" href="#">
         <span>
          Previous Video
         </span>
        </a>
        <a class="button next" href="#">
         <span>
          Next Video
         </span>
        </a>
       </nav>
      </div>
      <div id="announcements">
       <div class="announce-link">
        <a class="showing" href="/events/plan/space-reservations">
         <img src="/images/reservations-1.jpg"/>
        </a>
       </div>
       <div class="announce-link">
        <a class="showing" href="https://go.illinois.edu/beckmanboard">
         <img src="/content/uploads/images/JoinTheConvo.jpg"/>
        </a>
       </div>
      </div>
     </div>
     <!-- End Other News -->
    </div>
   </section>
   <section class="container clearfix" id="outlook">
    <div class="row">
     <h1>
      Weekly Outlook
     </h1>
     <ol class="clearfix" id="day-tabs">
      <li class="all expanded" data-date="2019-03-10">
       <a href="#">
        All
       </a>
      </li>
      <li data-date="2019-03-11">
       <a href="https://calendars.illinois.edu/day/4595?key=0000000020190311">
        <span>
         11
        </span>
        Mar
       </a>
      </li>
      <li data-date="2019-03-12">
       <a href="https://calendars.illinois.edu/day/4595?key=0000000020190312">
        <span>
         12
        </span>
        Mar
       </a>
      </li>
      <li data-date="2019-03-13">
       <a href="https://calendars.illinois.edu/day/4595?key=0000000020190313">
        <span>
         13
        </span>
        Mar
       </a>
      </li>
      <li data-date="2019-03-14">
       <a href="https://calendars.illinois.edu/day/4595?key=0000000020190314">
        <span>
         14
        </span>
        Mar
       </a>
      </li>
      <li data-date="2019-03-15">
       <a href="https://calendars.illinois.edu/day/4595?key=0000000020190315">
        <span>
         15
        </span>
        Mar
       </a>
      </li>
      <li data-date="2019-03-16">
       <a href="https://calendars.illinois.edu/day/4595?key=0000000020190316">
        <span>
         16
        </span>
        Mar
       </a>
      </li>
      <li data-date="2019-03-17">
       <a href="https://calendars.illinois.edu/day/4595?key=0000000020190317">
        <span>
         17
        </span>
        Mar
       </a>
      </li>
      <li data-date="2019-03-18">
       <a href="https://calendars.illinois.edu/day/4595?key=0000000020190318">
        <span>
         18
        </span>
        Mar
       </a>
      </li>
      <li data-date="2019-03-19">
       <a href="https://calendars.illinois.edu/day/4595?key=0000000020190319">
        <span>
         19
        </span>
        Mar
       </a>
      </li>
      <li data-date="2019-03-20">
       <a href="https://calendars.illinois.edu/day/4595?key=0000000020190320">
        <span>
         20
        </span>
        Mar
       </a>
      </li>
      <li data-date="2019-03-21">
       <a href="https://calendars.illinois.edu/day/4595?key=0000000020190321">
        <span>
         21
        </span>
        Mar
       </a>
      </li>
      <li data-date="2019-03-22">
       <a href="https://calendars.illinois.edu/day/4595?key=0000000020190322">
        <span>
         22
        </span>
        Mar
       </a>
      </li>
      <li data-date="2019-03-23">
       <a href="https://calendars.illinois.edu/day/4595?key=0000000020190323">
        <span>
         23
        </span>
        Mar
       </a>
      </li>
      <li class="calendar-link" data-date="all">
       <a href="https://calendars.illinois.edu/list/4595">
        Calendar »
       </a>
      </li>
     </ol>
     <div class="clearfix" id="day-menu">
      <div class="event-list">
       <h2>
        Upcoming Events
       </h2>
       <ol>
        <li class="default-event">
         <a href="https://calendars.illinois.edu/detail/4595?eventId=33324179">
          <time>
           03/11
          </time>
          Theoretical and Computational Biophysics Seminar
         </a>
        </li>
        <li class="default-event">
         <a href="https://calendars.illinois.edu/detail/4595?eventId=33335234">
          <time>
           03/12
          </time>
          Curious Eclectic Seminar Series
         </a>
        </li>
        <li class="default-event">
         <a href="https://calendars.illinois.edu/detail/4595?eventId=33335323">
          <time>
           03/12
          </time>
          2019 NSP Spring Seminar Series
         </a>
        </li>
        <li class="default-event">
         <a href="https://calendars.illinois.edu/detail/4595?eventId=33331265">
          <time>
           03/13
          </time>
          Yoga at Beckman
         </a>
        </li>
        <li class="default-event">
         <a href="https://calendars.illinois.edu/detail/4595?eventId=33333076">
          <time>
           03/13
          </time>
          BRL Seminar and Journal Club
         </a>
        </li>
        <li class="default-event">
         <a href="https://calendars.illinois.edu/detail/4595?eventId=33321447">
          <time>
           03/14
          </time>
          CCIL Faculty Seminar Series
         </a>
        </li>
       </ol>
      </div>
      <div class="menu-list">
       <h2>
        <a href="/about/services/beckman-cafe">
         Beckman Café:
         <i>
          March 10
         </i>
        </a>
       </h2>
       <h3 class="notice-message">
       </h3>
       <h3 class="default-heading">
        The cafe is closed
       </h3>
       <div class="default-message">
        Located at the west end of the Beckman Institute Atrium, the Beckman Café features flavored coffees, espresso, cappuccino, mocha, Italian and French sodas, and pastries of various kinds.
        <br/>
        Hours: M - F: 8 AM - 3:15PM
       </div>
      </div>
     </div>
     <div id="day-events">
      <ol class="event-list">
       <li data-date="2019-03-11">
        <a href="https://calendars.illinois.edu/detail/4595?eventId=33324179">
         Theoretical and Computational Biophysics Seminar
        </a>
        <time datetime="03/11/2019T12:00:00-05">
         March 11, 2019 at 3:00 pm
        </time>
       </li>
       <li data-date="2019-03-12">
        <a href="https://calendars.illinois.edu/detail/4595?eventId=33335234">
         Curious Eclectic Seminar Series
        </a>
        <time datetime="03/12/2019T12:00:00-05">
         March 12, 2019 at 12:00 pm
        </time>
       </li>
       <li data-date="2019-03-12">
        <a href="https://calendars.illinois.edu/detail/4595?eventId=33335323">
         2019 NSP Spring Seminar Series
        </a>
        <time datetime="03/12/2019T12:00:00-05">
         March 12, 2019 at 4:00 pm
        </time>
       </li>
       <li data-date="2019-03-13">
        <a href="https://calendars.illinois.edu/detail/4595?eventId=33331265">
         Yoga at Beckman
        </a>
        <time datetime="03/13/2019T12:00:00-05">
         March 13, 2019 at 12:00 pm
        </time>
       </li>
       <li data-date="2019-03-13">
        <a href="https://calendars.illinois.edu/detail/4595?eventId=33333076">
         BRL Seminar and Journal Club
        </a>
        <time datetime="03/13/2019T12:00:00-05">
         March 13, 2019 at 4:00 pm
        </time>
       </li>
       <li data-date="2019-03-14">
        <a href="https://calendars.illinois.edu/detail/4595?eventId=33321447">
         CCIL Faculty Seminar Series
        </a>
        <time datetime="03/14/2019T12:00:00-05">
         March 14, 2019 at 3:00 pm
        </time>
       </li>
       <li data-date="2019-03-15">
        <a href="https://calendars.illinois.edu/detail/4595?eventId=33333948">
         Inclusive Lab Leaders Workshop Session 2: Transforming Conflict into Collaboration
        </a>
        <time datetime="03/15/2019T12:00:00-05">
         March 15, 2019 at 9:30 am
        </time>
       </li>
       <li data-date="2019-03-15">
        <a href="https://calendars.illinois.edu/detail/4595?eventId=33338253">
         Molecular Science Discussion Group
        </a>
        <time datetime="03/15/2019T12:00:00-05">
         March 15, 2019 at 1:00 pm
        </time>
       </li>
       <li data-date="2019-03-18">
        <a href="https://calendars.illinois.edu/detail/4595?eventId=33324180">
         Theoretical and Computational Biophysics Seminar
        </a>
        <time datetime="03/18/2019T12:00:00-05">
         March 18, 2019 at 3:00 pm
        </time>
       </li>
       <li data-date="2019-03-22">
        <a href="https://calendars.illinois.edu/detail/4595?eventId=33338289">
         Molecular Science Discussion Group
        </a>
        <time datetime="03/22/2019T12:00:00-05">
         March 22, 2019 at 1:00 pm
        </time>
       </li>
       <li data-date="2019-03-26">
        <a href="https://calendars.illinois.edu/detail/4595?eventId=33324233">
         Responsible Conduct of Research Series
        </a>
        <time datetime="03/26/2019T12:00:00-05">
         March 26, 2019 at 12:00 pm
        </time>
       </li>
       <li data-date="2019-03-26">
        <a href="https://calendars.illinois.edu/detail/4595?eventId=33335839">
         Curious &amp; Eclectic Seminar: Smitha Vishveshwara, physics
        </a>
        <time datetime="03/26/2019T12:00:00-05">
         March 26, 2019 at 12:00 pm
        </time>
       </li>
       <li data-date="2019-03-26">
        <a href="https://calendars.illinois.edu/detail/4595?eventId=33335346">
         2019 NSP Spring Seminar Series
        </a>
        <time datetime="03/26/2019T12:00:00-05">
         March 26, 2019 at 4:00 pm
        </time>
       </li>
       <li data-date="2019-03-27">
        <a href="https://calendars.illinois.edu/detail/4595?eventId=33320912">
         Bench to Bedside Series-Carle Internal Medicine
        </a>
        <time datetime="03/27/2019T12:00:00-05">
         March 27, 2019 at 12:00 pm
        </time>
       </li>
       <li data-date="2019-03-27">
        <a href="https://calendars.illinois.edu/detail/4595?eventId=33331267">
         Yoga at Beckman
        </a>
        <time datetime="03/27/2019T12:00:00-05">
         March 27, 2019 at 12:00 pm
        </time>
       </li>
       <li data-date="2019-03-27">
        <a href="https://calendars.illinois.edu/detail/4595?eventId=33333078">
         BRL Seminar and Journal Club
        </a>
        <time datetime="03/27/2019T12:00:00-05">
         March 27, 2019 at 4:00 pm
        </time>
       </li>
       <li data-date="2019-03-27">
        <a href="https://calendars.illinois.edu/detail/4595?eventId=33337234">
         Frontiers in Miniature Brain Machinery Lecture
        </a>
        <time datetime="03/27/2019T12:00:00-05">
         March 27, 2019 at 4:00 pm
        </time>
       </li>
       <li data-date="2019-03-29">
        <a href="https://calendars.illinois.edu/detail/4595?eventId=33338290">
         Molecular Science Discussion Group
        </a>
        <time datetime="03/29/2019T12:00:00-05">
         March 29, 2019 at 1:00 pm
        </time>
       </li>
       <li data-date="2019-04-01">
        <a href="https://calendars.illinois.edu/detail/4595?eventId=33323779">
         Lyle Lanier Lecture
        </a>
        <time datetime="04/01/2019T12:00:00-05">
         April 01, 2019 at 4:00 pm
        </time>
       </li>
       <li data-date="2019-04-02">
        <a href="https://calendars.illinois.edu/detail/4595?eventId=33335236">
         Curious Eclectic Seminar Series
        </a>
        <time datetime="04/02/2019T12:00:00-05">
         April 02, 2019 at 12:00 pm
        </time>
       </li>
       <li data-date="2019-04-02">
        <a href="https://calendars.illinois.edu/detail/4595?eventId=33335347">
         2019 NSP Spring Seminar Series
        </a>
        <time datetime="04/02/2019T12:00:00-05">
         April 02, 2019 at 4:00 pm
        </time>
       </li>
       <li data-date="2019-04-03">
        <a href="https://calendars.illinois.edu/detail/4595?eventId=33318137">
         Graduate Student Seminar
        </a>
        <time datetime="04/03/2019T12:00:00-05">
         April 03, 2019 at 12:00 pm
        </time>
       </li>
       <li data-date="2019-04-03">
        <a href="https://calendars.illinois.edu/detail/4595?eventId=33331268">
         Yoga at Beckman
        </a>
        <time datetime="04/03/2019T12:00:00-05">
         April 03, 2019 at 12:00 pm
        </time>
       </li>
       <li data-date="2019-04-03">
        <a href="https://calendars.illinois.edu/detail/4595?eventId=33333079">
         BRL Seminar and Journal Club
        </a>
        <time datetime="04/03/2019T12:00:00-05">
         April 03, 2019 at 4:00 pm
        </time>
       </li>
       <li data-date="2019-04-04">
        <a href="https://calendars.illinois.edu/detail/4595?eventId=33310585">
         Director's Seminar by Prof. Narayan Aluru
        </a>
        <time datetime="04/04/2019T12:00:00-05">
         April 04, 2019 at 12:00 pm
        </time>
       </li>
       <li data-date="2019-04-05">
        <a href="https://calendars.illinois.edu/detail/4595?eventId=33337629">
         SmithGroup Lecture: "Taming Complexity: Controlling Networks" by Albert-László Barabási
        </a>
        <time datetime="04/05/2019T12:00:00-05">
         April 05, 2019 at 12:00 pm
        </time>
       </li>
       <li data-date="2019-04-05">
        <a href="https://calendars.illinois.edu/detail/4595?eventId=33338291">
         Molecular Science Discussion Group
        </a>
        <time datetime="04/05/2019T12:00:00-05">
         April 05, 2019 at 1:00 pm
        </time>
       </li>
       <li data-date="2019-04-09">
        <a href="https://calendars.illinois.edu/detail/4595?eventId=33335350">
         2019 NSP Spring Seminar Series
        </a>
        <time datetime="04/09/2019T12:00:00-05">
         April 09, 2019 at 4:00 pm
        </time>
       </li>
       <li data-date="2019-04-10">
        <a href="https://calendars.illinois.edu/detail/4595?eventId=33331269">
         Yoga at Beckman
        </a>
        <time datetime="04/10/2019T12:00:00-05">
         April 10, 2019 at 12:00 pm
        </time>
       </li>
       <li data-date="2019-04-10">
        <a href="https://calendars.illinois.edu/detail/4595?eventId=33333080">
         BRL Seminar and Journal Club
        </a>
        <time datetime="04/10/2019T12:00:00-05">
         April 10, 2019 at 4:00 pm
        </time>
       </li>
       <li data-date="2019-04-10">
        <a href="https://calendars.illinois.edu/detail/4595?eventId=33337236">
         Frontiers in Miniature Brain Machinery Lecture
        </a>
        <time datetime="04/10/2019T12:00:00-05">
         April 10, 2019 at 4:00 pm
        </time>
       </li>
       <li data-date="2019-04-12">
        <a href="https://calendars.illinois.edu/detail/4595?eventId=33323778">
         Cryo-EM Workshop
        </a>
        <time datetime="04/12/2019T12:00:00-05">
         April 12, 2019 at 8:00 am
        </time>
       </li>
       <li data-date="2019-04-12">
        <a href="https://calendars.illinois.edu/detail/4595?eventId=33323177">
         Science Communication Workshop
        </a>
        <time datetime="04/12/2019T12:00:00-05">
         April 12, 2019 at
        </time>
       </li>
       <li data-date="2019-04-12">
        <a href="https://calendars.illinois.edu/detail/4595?eventId=33333949">
         Inclusive Lab Leaders Workshop Session 3: Recognizing and Navigating Power Dynamics in Research
        </a>
        <time datetime="04/12/2019T12:00:00-05">
         April 12, 2019 at 9:30 am
        </time>
       </li>
       <li data-date="2019-04-12">
        <a href="https://calendars.illinois.edu/detail/4595?eventId=33338292">
         Molecular Science Discussion Group
        </a>
        <time datetime="04/12/2019T12:00:00-05">
         April 12, 2019 at 1:00 pm
        </time>
       </li>
       <li data-date="2019-04-16">
        <a href="https://calendars.illinois.edu/detail/4595?eventId=33335351">
         2019 NSP Spring Seminar Series
        </a>
        <time datetime="04/16/2019T12:00:00-05">
         April 16, 2019 at 4:00 pm
        </time>
       </li>
       <li data-date="2019-04-17">
        <a href="https://calendars.illinois.edu/detail/4595?eventId=33331270">
         Yoga at Beckman
        </a>
        <time datetime="04/17/2019T12:00:00-05">
         April 17, 2019 at 12:00 pm
        </time>
       </li>
       <li data-date="2019-04-17">
        <a href="https://calendars.illinois.edu/detail/4595?eventId=33333081">
         BRL Seminar and Journal Club
        </a>
        <time datetime="04/17/2019T12:00:00-05">
         April 17, 2019 at 4:00 pm
        </time>
       </li>
       <li data-date="2019-04-18">
        <a href="https://calendars.illinois.edu/detail/4595?eventId=33335882">
         Thursdays at 12:20 Concert: Evans-Hartley Experience
        </a>
        <time datetime="04/18/2019T12:00:00-05">
         April 18, 2019 at 12:00 pm
        </time>
       </li>
       <li data-date="2019-04-18">
        <a href="https://calendars.illinois.edu/detail/4595?eventId=33321448">
         CCIL Faculty Seminar Series
        </a>
        <time datetime="04/18/2019T12:00:00-05">
         April 18, 2019 at 3:00 pm
        </time>
       </li>
       <li data-date="2019-04-19">
        <a href="https://calendars.illinois.edu/detail/4595?eventId=33338293">
         Molecular Science Discussion Group
        </a>
        <time datetime="04/19/2019T12:00:00-05">
         April 19, 2019 at 1:00 pm
        </time>
       </li>
       <li data-date="2019-04-23">
        <a href="https://calendars.illinois.edu/detail/4595?eventId=33335353">
         2019 NSP Spring Seminar Series
        </a>
        <time datetime="04/23/2019T12:00:00-05">
         April 23, 2019 at 4:00 pm
        </time>
       </li>
       <li data-date="2019-04-24">
        <a href="https://calendars.illinois.edu/detail/4595?eventId=33331271">
         Yoga at Beckman
        </a>
        <time datetime="04/24/2019T12:00:00-05">
         April 24, 2019 at 12:00 pm
        </time>
       </li>
       <li data-date="2019-04-24">
        <a href="https://calendars.illinois.edu/detail/4595?eventId=33333082">
         BRL Seminar and Journal Club
        </a>
        <time datetime="04/24/2019T12:00:00-05">
         April 24, 2019 at 4:00 pm
        </time>
       </li>
       <li data-date="2019-04-26">
        <a href="https://calendars.illinois.edu/detail/4595?eventId=33337189">
         iOptics Seminar
        </a>
        <time datetime="04/26/2019T12:00:00-05">
         April 26, 2019 at 11:30 am
        </time>
       </li>
       <li data-date="2019-04-26">
        <a href="https://calendars.illinois.edu/detail/4595?eventId=33338294">
         Molecular Science Discussion Group
        </a>
        <time datetime="04/26/2019T12:00:00-05">
         April 26, 2019 at 1:00 pm
        </time>
       </li>
       <li data-date="2019-04-30">
        <a href="https://calendars.illinois.edu/detail/4595?eventId=33335366">
         2019 NSP Spring Seminar Series
        </a>
        <time datetime="04/30/2019T12:00:00-05">
         April 30, 2019 at 4:00 pm
        </time>
       </li>
       <li data-date="2019-05-01">
        <a href="https://calendars.illinois.edu/detail/4595?eventId=33318138">
         Graduate Student Seminar
        </a>
        <time datetime="05/01/2019T12:00:00-05">
         May 01, 2019 at 12:00 pm
        </time>
       </li>
       <li data-date="2019-05-01">
        <a href="https://calendars.illinois.edu/detail/4595?eventId=33331272">
         Yoga at Beckman
        </a>
        <time datetime="05/01/2019T12:00:00-05">
         May 01, 2019 at 12:00 pm
        </time>
       </li>
       <li data-date="2019-05-01">
        <a href="https://calendars.illinois.edu/detail/4595?eventId=33333083">
         BRL Seminar and Journal Club
        </a>
        <time datetime="05/01/2019T12:00:00-05">
         May 01, 2019 at 4:00 pm
        </time>
       </li>
       <li data-date="2019-05-02">
        <a href="https://calendars.illinois.edu/detail/4595?eventId=33315526">
         Director's Seminar
        </a>
        <time datetime="05/02/2019T12:00:00-05">
         May 02, 2019 at 12:00 pm
        </time>
       </li>
       <li data-date="2019-05-03">
        <a href="https://calendars.illinois.edu/detail/4595?eventId=33335908">
         Neurocardiology Research Workshop with Dr. Issam Moussa
        </a>
        <time datetime="05/03/2019T12:00:00-05">
         May 03, 2019 at 11:00 am
        </time>
       </li>
       <li data-date="2019-05-03">
        <a href="https://calendars.illinois.edu/detail/4595?eventId=33338295">
         Molecular Science Discussion Group
        </a>
        <time datetime="05/03/2019T12:00:00-05">
         May 03, 2019 at 1:00 pm
        </time>
       </li>
       <li data-date="2019-05-08">
        <a href="https://calendars.illinois.edu/detail/4595?eventId=33331273">
         Yoga at Beckman
        </a>
        <time datetime="05/08/2019T12:00:00-05">
         May 08, 2019 at 12:00 pm
        </time>
       </li>
       <li data-date="2019-05-08">
        <a href="https://calendars.illinois.edu/detail/4595?eventId=33333084">
         BRL Seminar and Journal Club
        </a>
        <time datetime="05/08/2019T12:00:00-05">
         May 08, 2019 at 4:00 pm
        </time>
       </li>
       <li data-date="2019-05-10">
        <a href="https://calendars.illinois.edu/detail/4595?eventId=33333950">
         Inclusive Lab Leaders Workshop Session 4: Creating Sustainable Systems to Support Our Work
        </a>
        <time datetime="05/10/2019T12:00:00-05">
         May 10, 2019 at 9:30 am
        </time>
       </li>
       <li data-date="2019-05-10">
        <a href="https://calendars.illinois.edu/detail/4595?eventId=33338296">
         Molecular Science Discussion Group
        </a>
        <time datetime="05/10/2019T12:00:00-05">
         May 10, 2019 at 1:00 pm
        </time>
       </li>
      </ol>
     </div>
     <div id="day-cafemenus">
      <ol data-date="2019-03-11">
       <li>
        Bruschetta Chicken  with Pesto Mashed Potatoes and Sautéed Zucchini
       </li>
       <li>
        Polish Sausage on Baguette
       </li>
       <li>
        Veggie Burger
        <img alt="This dish is vegan friendly" class="cafe-menu-icon" src="https://beckman.illinois.edu/content/uploads/images/menus/dish-quality/vegan.svg"/>
       </li>
       <li>
        Veggie Lentil Soup
        <img alt="This dish is vegan friendly" class="cafe-menu-icon" src="https://beckman.illinois.edu/content/uploads/images/menus/dish-quality/vegan.svg"/>
       </li>
       <li>
        Potato Gnocchi Soup
       </li>
       <li>
        Greek Salad
        <img alt="This dish is vegetarian friendly" class="cafe-menu-icon" src="https://beckman.illinois.edu/content/uploads/images/menus/dish-quality/vegetarian.svg"/>
       </li>
      </ol>
      <ol data-date="2019-03-12">
       <li>
        Pork Carnitas with Mexican Rice and Refried Beans
       </li>
       <li>
        Buffalo Chicken Wrap
       </li>
       <li>
        Cheese Quesadilla
        <img alt="This dish is vegetarian friendly" class="cafe-menu-icon" src="https://beckman.illinois.edu/content/uploads/images/menus/dish-quality/vegetarian.svg"/>
       </li>
       <li>
        Cream of Mushroom Soup
        <img alt="This dish is vegetarian friendly" class="cafe-menu-icon" src="https://beckman.illinois.edu/content/uploads/images/menus/dish-quality/vegetarian.svg"/>
       </li>
       <li>
        Buffalo Chicken Soup
       </li>
       <li>
        Greek Salad
        <img alt="This dish is vegetarian friendly" class="cafe-menu-icon" src="https://beckman.illinois.edu/content/uploads/images/menus/dish-quality/vegetarian.svg"/>
       </li>
       <li>
        Kale Salad
        <img alt="This dish is vegan friendly" class="cafe-menu-icon" src="https://beckman.illinois.edu/content/uploads/images/menus/dish-quality/vegan.svg"/>
       </li>
      </ol>
      <ol data-date="2019-03-13">
       <li>
        Teriyaki Chicken with Brown Rice and Crab Rangoon
       </li>
       <li>
        Banh Mi Beef Wrap
       </li>
       <li>
        Hummus with Pita
        <img alt="This dish is vegan friendly" class="cafe-menu-icon" src="https://beckman.illinois.edu/content/uploads/images/menus/dish-quality/vegan.svg"/>
       </li>
       <li>
        Potato Leek Soup
        <img alt="This dish is vegetarian friendly" class="cafe-menu-icon" src="https://beckman.illinois.edu/content/uploads/images/menus/dish-quality/vegetarian.svg"/>
       </li>
       <li>
        Spicy Thai Chicken Soup
       </li>
       <li>
        Greek Salad
        <img alt="This dish is vegetarian friendly" class="cafe-menu-icon" src="https://beckman.illinois.edu/content/uploads/images/menus/dish-quality/vegetarian.svg"/>
       </li>
       <li>
        Mixed Greens
        <img alt="This dish is vegan friendly" class="cafe-menu-icon" src="https://beckman.illinois.edu/content/uploads/images/menus/dish-quality/vegan.svg"/>
       </li>
      </ol>
      <ol data-date="2019-03-14">
       <li>
        Pot Roast  with Mashed Potatoes and Green Beans
       </li>
       <li>
        Apple Walnut Chicken Salad
       </li>
       <li>
        Mushroom Flatbread
        <img alt="This dish is vegetarian friendly" class="cafe-menu-icon" src="https://beckman.illinois.edu/content/uploads/images/menus/dish-quality/vegetarian.svg"/>
       </li>
       <li>
        Southwestern Corn Chowder
        <img alt="This dish is vegetarian friendly" class="cafe-menu-icon" src="https://beckman.illinois.edu/content/uploads/images/menus/dish-quality/vegetarian.svg"/>
       </li>
       <li>
        Chicken Noodle Soup
       </li>
       <li>
        Greek Salad
        <img alt="This dish is vegetarian friendly" class="cafe-menu-icon" src="https://beckman.illinois.edu/content/uploads/images/menus/dish-quality/vegetarian.svg"/>
       </li>
      </ol>
      <ol data-date="2019-03-15">
       <li>
        Blackened Tilapia with Long Grain and Wild Rice and Mixed Vegetables
       </li>
       <li>
        Shrimp Po’ Boy
       </li>
       <li>
        Black Bean Burger
        <img alt="This dish is vegan friendly" class="cafe-menu-icon" src="https://beckman.illinois.edu/content/uploads/images/menus/dish-quality/vegan.svg"/>
       </li>
       <li>
        Tomato Basil Bisque
        <img alt="This dish is vegetarian friendly" class="cafe-menu-icon" src="https://beckman.illinois.edu/content/uploads/images/menus/dish-quality/vegetarian.svg"/>
       </li>
       <li>
        New Eng. Clam Chowder
       </li>
       <li>
        Greek Salad
        <img alt="This dish is vegetarian friendly" class="cafe-menu-icon" src="https://beckman.illinois.edu/content/uploads/images/menus/dish-quality/vegetarian.svg"/>
       </li>
       <li>
        Kale Salad
        <img alt="This dish is vegan friendly" class="cafe-menu-icon" src="https://beckman.illinois.edu/content/uploads/images/menus/dish-quality/vegan.svg"/>
       </li>
      </ol>
     </div>
    </div>
   </section>
   <footer class="container">
    <div class="navwrap row">
     <nav id="navfooter-global">
      <ul class="sections clearfix">
       <li class="about" data-section="about">
        <a href="/about">
         About
        </a>
       </li>
       <li class="research" data-section="research">
        <a href="/research">
         Research
        </a>
       </li>
       <li class="news" data-section="news">
        <a href="/news">
         News
        </a>
       </li>
       <li class="video" data-section="video">
        <a href="/video">
         Video
        </a>
       </li>
       <li class="events" data-section="events">
        <a href="/events">
         Events
        </a>
       </li>
       <li class="directory" data-section="directory">
        <a href="/directory">
         People
        </a>
       </li>
       <li class="contact">
        <a href="/about/contact">
         Contact
        </a>
       </li>
       <li class="social-link linkedin">
        <a href="https://www.linkedin.com/company/beckman-institute-at-illinois">
         <span class="visuallyhidden">
          Linkedin
         </span>
        </a>
       </li>
       <li class="social-link youtube">
        <a href="https://youtube.com/beckmaninstitute">
         <span class="visuallyhidden">
          Youtube
         </span>
        </a>
       </li>
       <li class="social-link twitter">
        <a href="https://twitter.com/beckmaninst">
         <span class="visuallyhidden">
          Twitter
         </span>
        </a>
       </li>
       <li class="social-link facebook">
        <a href="https://facebook.com/beckmaninstitute">
         <span class="visuallyhidden">
          Facebook
         </span>
        </a>
       </li>
      </ul>
     </nav>
    </div>
    <div class="footer-wordmark">
     <a href="https://illinois.edu">
      <img alt="University of Illinois wordmark" src="/content/images/footer-wordmark.png"/>
     </a>
     <br>
      <a class="strategic-link" href="https://strategicplan.illinois.edu/">
       View the Campus Strategic Plan
      </a>
      <a class="privacy-policy" href="https://www.vpaa.uillinois.edu/resources/web_privacy">
       Privacy Policy
      </a>
      <!-- OneTrust Cookies Settings button start -->
      <a class="optanon-show-settings" role="button" tabindex="0">
       Cookie Settings
      </a>
      <!-- OneTrust Cookies Settings button end -->
     </br>
    </div>
   </footer>
  </div>
  <!-- js includes -->
  <script src="/bundles/jquery">
  </script>
  <script>
   window.jQuery || document.write('<script src="/scripts/jquery-2.1.3.min.js"><\/script><script src="/Scripts/jquery-ui-1.11.2.min.js"><\/script>')
  </script>
  <script src="/bundles/local-js?v=AqhSxre7F1JB53kjP0yfExeju5enY7aog17UucG8dSw1">
  </script>
  <script src="https://emergency.webservices.illinois.edu/illinois.js" type="text/javascript">
  </script>
  <!-- OneTrust Cookies Consent Notice (Production CDN, illinois.edu, en-GB) start -->
  <script charset="UTF-8" src="https://cdn.cookielaw.org/consent/fd31c61a-15d6-4769-9802-5eafcc1098ba.js" type="text/javascript">
  </script>
  <script type="text/javascript">
   function OptanonWrapper() { }
  </script>
  <!-- OneTrust Cookies Consent Notice (Production CDN, illinois.edu, en-GB) end -->
  <!-- end includes -->
 </body>
</html>
